{
 "url": "https://ithouseedu.uz/courses/8-foundation",
 "school_id": "it-house",
 "snapshot_date": "2026-09-16",
 "is_archive": false,
 "stage": "основной продукт",
 "builder": "Next.js",
 "pixels": [
  "Google Analytics (GA4)"
 ],
 "promise": {
  "found": true,
  "value": "С нуля научиться пользоваться компьютером как профессионал",
  "quote": "0dan kompyuterdan professionallardek foydalanishni o'rganing!",
  "where": "первый экран"
 },
 "income_claim": {
  "found": false,
  "where": "не найдено"
 },
 "audience": {
  "found": false,
  "where": "не найдено"
 },
 "program": {
  "found": false
 },
 "speaker": {
  "found": false,
  "where": "не найдено"
 },
 "social_proof": {
  "types": [
   "нет"
  ],
  "reviews_count": 0
 },
 "price": {
  "found": false,
  "hidden_reason": "цены нет ни на странице курса, ни на главной; кроме одной фразы о курсе — только общий блок «Contact» с формой (выбор курса → «Yuborish») и телефонами"
 },
 "installments": {
  "found": false,
  "where": "не найдено"
 },
 "guarantee": {
  "found": false,
  "where": "не найдено"
 },
 "discounts": {
  "found": false,
  "where": "не найдено"
 },
 "bonuses": {
  "found": false,
  "where": "не найдено"
 },
 "deadline": {
  "found": false,
  "where": "не найдено"
 },
 "form": {
  "present": true,
  "fields": [
   "другое"
  ]
 },
 "next_step": "звонок менеджера",
 "closed": true,
 "notes": "Шаблонная страница: баннер, заголовок и одна фраза. Программы, длительности, формата, преподавателя, отзывов, цены, рассрочки, гарантии, скидок, бонусов и дедлайна нет. Длительность — только на карточке главной: «2 oy»; наставник направления — только на главной (Noʻmonjonov Shohruhmirzo, Foundation, стаж 3+, 410+ учеников — самоотчёт). Аудитория прямо не названа — есть только «0dan» (с нуля) в обещании. Противоречие: текст страницы — про компьютерную грамотность с нуля, а на баннере-картинке крупно «Foundation dasturlash» и подпись про основы программирования и логическое мышление (прочитано по скриншоту). Самые показываемые объявления IT House — 14 видео (ранги 1–3, 11–13, 22–25; с 27.08–03.09; «Learn more»; ссылки в выгрузке нет) — продают ускоренный курс офисных программ («tezlashtirilgan kurs»). Ближайший курс на сайте — Foundation, но об ускоренном формате и офисных программах на странице ни слова, и на сайт эти объявления не ведут. Форма: в снимке виден только список «Kursni tanlang» (в схеме «другое») и кнопка «Yuborish»; поля ввода в текстовый снимок не попадают. Следующий шаг «звонок менеджера» — вывод, прямо не сказано. Оферты и юридических документов нет. Скриншот — первый экран: баннер, заголовок, карточка с почти невидимым текстом (светло-серый на белом), кнопка «Contact»."
}
