{
 "url": "https://mini-web.englify.uz/m2y7cv",
 "school_id": "englify",
 "snapshot_date": "2026-09-16",
 "is_archive": false,
 "stage": "вебинар или мастер-класс",
 "builder": "своя сборка (фреймворк не определён)",
 "pixels": [
  "Google Analytics (GA4)"
 ],
 "promise": {
  "found": true,
  "value": "Бесплатный мастер-класс: учить английский «с энергией»; методика — заговорить за 30 дней, применять выученные слова, говорить уверенно без страха ошибок",
  "quote": "BEPUL MASTER-KLASS\n22-23-24 Sentyabr·Soat 20:00\nIngliz tilini energiya bilan oʻrganish",
  "where": "первый экран"
 },
 "income_claim": {
  "found": false,
  "where": "не найдено"
 },
 "audience": {
  "found": false,
  "where": "не найдено"
 },
 "program": {
  "found": true,
  "duration": "22, 23 и 24 сентября в 20:00 — одна встреча на выбор или серия из трёх, на странице не сказано",
  "format": "онлайн",
  "quote": "Master-klassda siz:\n30 kunda ingliz tilida gapirishni boshlash metodikasini\nYodlagan soʻzlaringizni amalda ishlatishni\nXatolardan qoʻrqmay, ishonch bilan gapirishni oʻrganasiz"
 },
 "speaker": {
  "found": true,
  "value": "Teacher Azam — подпись (alt) фото ведущего на первом экране; в видимом тексте имени нет, в описании страницы — «Teacher Azam bilan bepul master-klass…»",
  "quote": "Teacher Azam",
  "where": "первый экран"
 },
 "social_proof": {
  "types": [
   "нет"
  ]
 },
 "price": {
  "found": false,
  "hidden_reason": "бесплатный мастер-класс («BEPUL MASTER-KLASS») — цены нет, цена курса не упоминается"
 },
 "installments": {
  "found": false,
  "where": "не найдено"
 },
 "guarantee": {
  "found": false,
  "where": "не найдено"
 },
 "discounts": {
  "found": false,
  "where": "не найдено"
 },
 "bonuses": {
  "found": false,
  "where": "не найдено"
 },
 "deadline": {
  "found": true,
  "value": "Даты мастер-класса: 22, 23 и 24 сентября в 20:00 (год не указан; снимок от 16.09.2026)",
  "quote": "22-23-24 Sentyabr·Soat 20:00",
  "where": "первый экран"
 },
 "form": {
  "present": true,
  "fields": [
   "имя",
   "телефон"
  ]
 },
 "next_step": "Telegram-канал",
 "closed": true,
 "message_match": {
  "library_id": "2700381317085700",
  "scores": {
   "promise_continuity": 7,
   "language_match": 6,
   "visual_continuity": 6,
   "cta_alignment": 8,
   "specificity_match": 6,
   "emotional_match": 7
  },
  "total_of_60": 40
 },
 "notes": "Вариант страницы бесплатного мастер-класса (общее описание серии — в разборе mini-web-englify-uz-p4v9tz-3d58b4): фиолетовая тема, бейджи «Speaking» и «Amaliy mashqlar», фото ведущего со сложенными руками; пункты — набор «30 kunda … / Yodlagan soʻzlaringizni amalda ishlatishni / Xatolardan qoʻrqmay, ishonch bilan gapirishni oʻrganasiz»; форма на первом экране («Ismingiz», «Telefon raqamingiz», «Raqamingiz faqat shu efir uchun ishlatiladi.»). Цены, отзывов, программы по дням, оферты нет. Куда ведёт регистрация, на странице не сказано; next_step «Telegram-канал» — по роликам мастер-класса (регистрация и вступление в закрытый Telegram-канал ведущего). Техника: в intel.json только GA4; вставки englify-*. Реклама: 3 объявления — 2700381317085700 с 11.09 (6 дней) и два с 15.09 (кнопка-подпись «BEPUL MASTER-KLASSDA QATNASHISH»), текст общий для серии («… ✅ 30 kunda ingliz tilida gapirishni boshlash ✅ Til o'rganishni yarimida tashlab ketmay, oxirigacha borish siri … IELTS yoki milliy sertifikatidan yuqori ball …»). message_match: объявление 2700381317085700 (6 дней). Ролик (черновая расшифровка, 32 с): ведущий в офисе, титр «INGLIZ TILINI» — начинали учить английский и бросили от скуки: грамматика и зубрёжка слов скучны; результат будет, если смотреть фильмы, подкасты и любимые видео; «Teacher Azam»; 22–24 сентября бесплатный онлайн-мастер-класс о том, как учить английский без скуки и эффективно; регистрация по ссылке и закрытый Telegram-канал. Заголовок «energiya bilan» по смыслу отвечает на «скучно» из ролика, но другими словами; с текстом рекламы совпадает только пункт «30 kunda … gapirishni boshlash» — про «tushunib lekin gapirolmaslik», «oxirigacha» и IELTS на странице ничего нет; совпадают даты и «bepul»."
}
