{
 "url": "https://mini-web.englify.uz/r5m8kd",
 "school_id": "englify",
 "snapshot_date": "2026-09-16",
 "is_archive": false,
 "stage": "вебинар или мастер-класс",
 "builder": "своя сборка (фреймворк не определён)",
 "pixels": [
  "Google Analytics (GA4)"
 ],
 "promise": {
  "found": true,
  "value": "Бесплатный мастер-класс: секреты изучения английского в любом возрасте; «секретная методика» запоминания до 50 слов в день",
  "quote": "BEPUL MASTER-KLASS\n22-23-24 Sentyabr·Soat 20:00\nIngliz tilini istalgan yoshda oʻrganish sirlari",
  "where": "первый экран"
 },
 "income_claim": {
  "found": false,
  "where": "не найдено"
 },
 "audience": {
  "found": true,
  "value": "Люди любого возраста — через заголовок",
  "quote": "Ingliz tilini istalgan yoshda oʻrganish sirlari",
  "where": "первый экран"
 },
 "program": {
  "found": true,
  "duration": "22, 23 и 24 сентября в 20:00 — одна встреча на выбор или серия из трёх, на странице не сказано",
  "format": "неизвестно",
  "quote": "Masterklassda siz:\nKuniga 50 tagacha soʻz yodlashning sirli metodikasini\nYodlagan soʻzlaringizni bir umr eslab qolishni\nBilgan soʻzlaringizning hammasini amalda ishlatishni oʻrganasiz"
 },
 "speaker": {
  "found": true,
  "value": "Teacher Azam — подпись (alt) фото ведущего на первом экране; в видимом тексте имени нет, в описании страницы — «Teacher Azam bilan bepul master-klass…»",
  "quote": "Teacher Azam",
  "where": "первый экран"
 },
 "social_proof": {
  "types": [
   "нет"
  ]
 },
 "price": {
  "found": false,
  "hidden_reason": "бесплатный мастер-класс («BEPUL MASTER-KLASS») — цены нет, цена курса не упоминается"
 },
 "installments": {
  "found": false,
  "where": "не найдено"
 },
 "guarantee": {
  "found": false,
  "where": "не найдено"
 },
 "discounts": {
  "found": false,
  "where": "не найдено"
 },
 "bonuses": {
  "found": false,
  "where": "не найдено"
 },
 "deadline": {
  "found": true,
  "value": "Даты мастер-класса: 22, 23 и 24 сентября в 20:00 (год не указан; снимок от 16.09.2026)",
  "quote": "22-23-24 Sentyabr·Soat 20:00",
  "where": "первый экран"
 },
 "form": {
  "present": true
 },
 "next_step": "Telegram-канал",
 "closed": true,
 "message_match": {
  "library_id": "1071510362256033",
  "scores": {
   "promise_continuity": 8,
   "language_match": 6,
   "visual_continuity": 6,
   "cta_alignment": 8,
   "specificity_match": 5,
   "emotional_match": 8
  },
  "total_of_60": 41
 },
 "notes": "Вариант страницы бесплатного мастер-класса (общее описание серии — в разборе mini-web-englify-uz-p4v9tz-3d58b4) из серии про слова: красно-чёрная тема (как k7m2xq), фото ведущего, поправляющего очки; меню «Masterklass», «Dastur» (ведёт на #royxat); пункты про 50 слов в день. Формы в тексте снимка и на скриншоте нет — только кнопки «ROʻYXATDAN OʻTISH»; по вставкам «englify-modal-fix» и «englify-phone-intl» форма, видимо, во всплывающем окне: form.present = true, поля не указаны. Слова «efir» нет — format «неизвестно» (в роликах — «bepul online masterclass»). Цены, отзывов, оферты нет. Куда ведёт регистрация, на странице не сказано; next_step «Telegram-канал» — по роликам (регистрация и закрытый Telegram-канал). Техника: в intel.json только GA4; вставки englify-*. Реклама: 2 объявления с 15.09.2026 (2 дня), текст общий для серии («… ✅ 30 kunda ingliz tilida gapirishni boshlash ✅ Til o'rganishni yarimida tashlab ketmay, oxirigacha borish siri … IELTS yoki milliy sertifikatidan yuqori ball …»), кнопка-подпись «BEPUL MASTER-KLASSDA QATNASHISH». message_match: объявление 1071510362256033 (при равных днях — с 2 копиями). Ролик (черновая расшифровка, 39 с): ведущий крупным планом в офисе, титры «BO‘LDI ENDI O‘RGANOLMAYMAN … O‘TIB KETTI», вставка с пожилыми мужчинами — думаете, что возраст уже прошёл? учиться никогда не поздно; ведущий помог 25 тысячам учеников, среди них врачи, госслужащие и учителя 30–35 лет, получившие даже B2 (самоотчёт); «Teacher Azam»; 22–24 сентября бесплатный онлайн-мастер-класс: заговорить с нуля за 30 дней на бытовые темы и эффективно получить сертификат B2; регистрация по ссылке и закрытый Telegram-канал. Превью этого ролика побайтно совпадает с превью объявления 1602950504954305, которое ведёт на w7b3jt («30 daqiqa»), — один ролик на две страницы. Заголовок «istalgan yoshda» точно отвечает на страх ролика «возраст прошёл»; но пункты страницы — про 50 слов в день, а ролик обещает разговор за 30 дней и B2; 25 тысяч учеников, B2 и IELTS на странице нет."
}
